Market,Category,URL,ASIN,Date,Time,Title,Ratting,Availability,Desc,list_price,Image,Brand,Seller_Rank,customer_ratting,ship_by,sold_by,Is_new,Date_First_Available,Tables
US,automotive,https://www.amazon.com/dp/B07VCBQ6KF,B07VCBQ6KF,28/05/2022,15:10:29,TICARVE Cleaning Gel for Car Detailing Tools Car Cleaning Kit Automotive Dust Air Vent Interior Detail Detailing Putty Universal Dust Cleaner for Auto Laptop Car Slime Cleaner,4.1 out of 5 stars,In Stock.,"This fits your . Make sure this fits by entering your model number. 🚕【Perfect for Car Cleaning】Dust cleaning gel for car is perfect for cleaning the nooks and crannies in your car or truck. Cleaning car gel cleaner is super great to get into the vents and little crevices on the car air vents, steering wheels, console panel, storage bins, cup holder, door handles, dashboards to pick up the dirt🚗【Easy to Use】Take out the car cleaning slime with dry hands, knead a few times. Press the car vent cleaner slightly on the dust surface and pull out the car cleaning putty slowly the dirt would be carried away with the car cleaner slime🚘【Reusable】Car detailing putty can be used multiple times till the color of the car goo cleaner car jelly cleaner turn to dark. After use, just put the car goop cleaner back into the jar and sealed storage in cool place (below 104°F). 🚱Note: Don’t wash the car cleaning gel with water🌿【High-tech Material】Car slime for cleaning is made of high-tech cleaning material with lavender scent. Car putty for cleaning sticky dust but not sticky to hands. Car cleaning goo pick up dust and debris and leaves no residue.🚚【Brand New Package】All TICARVE car putty cleaner are sold brand new. If you find that the package is opened or damaged, the car detailing kit dirty or any other issues when you receive the cleaning gel putty, please message us in time, we will give you a full refund and send you a new replacement› See more product details",$6.98,https://images-na.ssl-images-amazon.com/images/I/71j60x8bWxL.__AC_SX300_SY300_QL70_FMwebp_.jpg,TICARVE,#72 in Automotive (See Top 100 in Automotive)#6 in Interior Care Products,"41,851 ratings",Ships from Amazon , TICARVE,No,"July 16, 2019","{'ASIN': 'B07VCBQ6KF', 'Customer Reviews': '4.1 out of 5 stars41,851 ratings4.1 out of 5 stars', 'Best Sellers Rank': '#72 in Automotive (See Top 100 in Automotive)#6 in Interior Care Products', 'Date First Available': 'July 16, 2019', 'Manufacturer': 'TICARVE', 'Brand': 'TICARVE', 'Item Weight': '6.7 ounces', 'Package Dimensions': '2.68 x 2.64 x 2.44 inches', 'Item model number': 'TCG001-blue', 'Manufacturer Part Number': 'TCG001-blue'}"
US,automotive,https://www.amazon.com/dp/B09LYDP13X,B09LYDP13X,28/05/2022,15:10:43,"Qifutan Phone Mount for Car Vent [2022 Upgraded Clip] Cell Phone Holder Car Hands Free Cradle in Vehicle Car Phone Holder Mount Fit for Smartphone, iPhone, Cell Phone Automobile Cradles Universal",4.6 out of 5 stars,In Stock.,"About this itemUpgraded Vent Clip: The Car phone mount features a stronger, thinner vent clip and an innovative support ring for extra support, which could hold your phone securely on an air vent in your car. NOTE: THIS CAR MOUNT FOR PHONE is ONLY MATCHED WITH HORIZONTAL BLADE AIR VENTSAdjustable Attachment: The phone holder car features an adjustable support ring, it can be rotated to any angle without blocking the vents. The Adjustable Bottom Foot can fit all phonesInnovative Hollow Silicone Rubber: The car mount for iPhone is armed with an innovative hollow silicone rubber, which is more stable when compared with other common silicone rubbers. When you put your phone on the car phone mount, your phone can fully fit the hollow silicone rubber cushion so that it won't drop at allPerfect Protection: The car vent phone mount is equipped with a thick layer of silicone which could protect your smartphone from wear and tearIdeal Viewing Angle: The 360° rotating and pivoting ball joint can be adjusted to any viewing angle and quickly switch between vertical and horizontal visual angles",$12.99$12.99,https://images-na.ssl-images-amazon.com/images/I/71slV0D1MML.__AC_SY300_SX300_QL70_FMwebp_.jpg,Qifutan,#203 in Cell Phones & Accessories (See Top 100 in Cell Phones & Accessories)#1 in Cell Phone Mounts#9 in Cell Phone Automobile Cradles,"1,258 ratings",Ships from Amazon , Qifutan Direct US,Yes,"November 16, 2021","{'Package Dimensions': '4.72 x 3.11 x 3.07 inches', 'Item Weight': '5 ounces', 'ASIN': 'B09LYDP13X', 'Item model number': 'HD-C78', 'Customer Reviews': '4.6 out of 5 stars1,258 ratings4.6 out of 5 stars', 'Best Sellers Rank': '#203 in Cell Phones & Accessories (See Top 100 in Cell Phones & Accessories)#1 in Cell Phone Mounts#9 in Cell Phone Automobile Cradles', 'OS': 'IOS, Android', 'Special Features': 'Air Vent Holder Mount, Travel Car Phone Holder Mount, Anti-Scratch Car Vent Phone Mount, Support Thick Cases Car Mount, One-hand Operation Phone Holder Car', 'Manufacturer': 'Qifutan', 'Date First Available': 'November 16, 2021'}"
US,automotive,https://www.amazon.com/dp/B07P7NFV1F,B07P7NFV1F,28/05/2022,15:10:54,"Holikme 20Piece Drill Brush Attachments Set, Scrub Pads & Sponge, Buffing Pads, Power Scrubber Brush with Extend Long Attachment, Car Polishing Pad Kit",4.5 out of 5 stars,In Stock.,"About this item* * ✔ 20 Piece Drill Cleaning Attachment Set（Brush&Scouring Pads&Scrub Sponge), Includes: 6 shape of Medium drill power scrubber brushes, 9 Piece different stiffnesses Scouring pads，3 Piece scrub sponge and 4 inch backer and 1 Extension rod..* * ✔ 6 shape of brushes clean your bathtub, grout, upholstery, bathroom surface, floor, tile, shower, toilet and carpet etc, Nylon bristles will not scratch surfaces of them.* * ✔9 Piece DIFFERENT STIFFNESSES Scouring Pads and 3 Piece Scrub Sponge : perfect for kitchen cleaning Oven Stove Cooktop Sink Cast Iron Skillet Frying Pan Pots and Pans . The green pads are a bit stiffer and thicker than the red ones.* * ✔Time Saving: Get tired of the boring household cleaning? Try Holikme Power Scrubbing Drill Brush Cleaning brushes and Scouring Pads that attach to any cordless drill or impact driver, become a powerful cleaning tool. Get stubborn cleaning jobs done faster and achieve a deeper clean, definitely a good partner for your household cleaning. (DRILL IS NOT INCLUDED)* * ✔ Good Satisfaction – Every Holikme Drill Brush Attachment cleaning Product is good working performance and high quality.",$19.95,https://images-na.ssl-images-amazon.com/images/I/810td6ZwYdL.__AC_SX300_SY300_QL70_FMwebp_.jpg,Holikme,#40 in Automotive (See Top 100 in Automotive)#1 in Machine Polishing Equipment#6 in Household Cleaning Brushes,"33,846 ratings",Ships from Amazon , Holikme Store,Yes,,"{'Package Dimensions': '10.28 x 6.85 x 4.69 inches', 'Item Weight': '1.9 pounds', 'Manufacturer': 'Holikme', 'ASIN': 'B07P7NFV1F', 'Item model number': '8541813326', 'Customer Reviews': '4.5 out of 5 stars33,846 ratings4.5 out of 5 stars', 'Best Sellers Rank': '#40 in Automotive (See Top 100 in Automotive)#1 in Machine Polishing Equipment#6 in Household Cleaning Brushes', 'Batteries Required?': 'No'}"
US,automotive,https://www.amazon.com/dp/B00TRTSAZM,B00TRTSAZM,28/05/2022,15:11:05,DELUXE TRUNK MOUNTED BIKE RACK,4.5 out of 5 stars,In Stock.,"About this itemThis fits your . Make sure this fits by entering your model number. Patented design fits sedans, hatchbacks, minivans, and SUV's consult manufacturer web site for specific vehicle fit informationSide straps for increased lateral stability. Single configuration design eliminates setup hassles and headaches during installationIndividual tie downs secure and protect bicyclesPadded lower frame keeps bicycles away from vehicleShips in certified frustration free packaging 70 pounds max capacityComes fully assembled set up and installs in seconds 12 inch long carry arms easily accommodate a wide range of bicycle styles and 115 inch wide carry arms for greater bike compatibilityAllen's warranty does not cover items purchased through third-party sellersImportant, please consult manufacturer web page for specific vehicle fit",$32.88,https://images-na.ssl-images-amazon.com/images/I/61PR8dl8smL.__AC_SY300_SX300_QL70_FMwebp_.jpg,Allen Sports,#199 in Sports & Outdoors (See Top 100 in Sports & Outdoors)#1 in Bicycle Car Racks,"34,661 ratings",Ships from Amazon.com ," Amazon.com Packaging Shows what’s inside.To hide it, choose Ship in Amazon Packaging at Checkout.",Yes,"October 8, 2013","{'ASIN': 'B00TRTSAZM', 'Customer Reviews': '4.5 out of 5 stars34,661 ratings4.5 out of 5 stars', 'Best Sellers Rank': '#199 in Sports & Outdoors (See Top 100 in Sports & Outdoors)#1 in Bicycle Car Racks', 'Date First Available': 'October 8, 2013', 'Item Package Dimensions L x W x H': '23.46 x 13.7 x 4.41 inches', 'Package Weight': '3.54 Kilograms', 'Item Dimensions  LxWxH': '23.03 x 13.58 x 3.94 inches', 'Item Weight': '7.5 Pounds', 'Brand Name': 'Allen Sports', 'Country of Origin': 'China', 'Warranty Description': 'If an Allen Rack fails to function properly due to a defect in workmanship or material over the lifetime of the original purchaser, simply return the product with your original receipt, and Allen will repair or replace the rack free of charge. This warranty does not cover damage or wear which occurs as a result of day to day use or general wear and tear', 'Model Name': '102DN-R', 'Color': 'Black', 'Material': 'Alloy Steel', 'Suggested Users': 'Mens', 'Number of Items': '1', 'Manufacturer': 'Allen Sports', 'Part Number': '102DN-R', 'Style': '2-bike', 'Included Components': 'Bicycle carrier', 'Size': '2 Bike', 'Sport Type': 'Biking'}"
US,automotive,https://www.amazon.com/dp/B00FJIT9BO,B00FJIT9BO,28/05/2022,15:11:17,"Chemical Guys TVD_107_16 V.R.P. Vinyl, Rubber and Plastic Non-Greasy Dry-to-the-Touch Long Lasting Super Shine Dressing for Tires, Trim and More (16 Oz)",4.6 out of 5 stars,In Stock.,"V.R.P. super shine dressing is a dry-to-the-tough water-based dressing that works great on leather, vinyl, plastic, rubber and tires. V.R.P. can be used on both interior and exterior surfaces. It creates an invisible shield that repels water, dirt and dust. It also protects surfaces from damaging UV rays. V.R.P. super shine dressing resists drying, fading and cracking surfaces to aid in maintaining interior and exterior surfaces while at the same time enhancing shine and image. V.R.P. super shine dressing not only provides shine and protection, it is 100 percent dry-to-the-touch which means it is never greasy or oily. V.R.P. super shine dressing brings out the true shine and texture of leather, vinyl, plastic, rubber and tires. It can be applied as often as you like without the fear of any clouding or discoloration. V.R.P. super shine dressing features patented UV absorbers that penetrate deep into surfaces and act as a protective barrier against harmful UV rays that can cause premature aging, cracking, fading and peeling. The UV protection in V.R.P. Dressing protects surfaces from fading and dulling.",$9.99$9.99,https://images-na.ssl-images-amazon.com/images/I/71M8zhA2MzL.__AC_SX300_SY300_QL70_FMwebp_.jpg,Chemical Guys,#51 in Automotive (See Top 100 in Automotive)#1 in Automotive Tire Care,"21,931 ratings",Ships from Amazon.com , Amazon.com,Yes,"February 18, 2009","{'ASIN': 'B00FJIT9BO', 'Customer Reviews': '4.6 out of 5 stars21,931 ratings4.6 out of 5 stars', 'Best Sellers Rank': '#51 in Automotive (See Top 100 in Automotive)#1 in Automotive Tire Care', 'Domestic Shipping': 'Item can be shipped within U.S.', 'International Shipping': 'This item can be shipped to select countries outside of the U.S.Learn More', 'Date First Available': 'February 18, 2009', 'Manufacturer': 'Chemical Guys', 'Brand': 'Chemical Guys', 'Model': 'TVD_107_16', 'Item Weight': '1.19 pounds', 'Product Dimensions': '8.27 x 2.36 x 2.36 inches', 'Country of Origin': 'USA', 'Item model number': 'TVD_107_16SW', 'Is Discontinued By Manufacturer': 'No', 'Manufacturer Part Number': 'TVD_107_16SW', 'OEM Part Number': 'TVD-107-16'}"
US,automotive,https://www.amazon.com/dp/B014TYRQUY,B014TYRQUY,28/05/2022,15:11:29,EPAuto CP285 (CF10285) Premium Cabin Air Filter includes Activated Carbon,4.7 out of 5 stars,In Stock.,"This fits your . Make sure this fits by entering your model number. Clean air for driver and passengersContains soda and carbon to generate fresh breeze airEnhanced HVAC performance, Recommended replacement every 12 months or 12,000 miles.Replacement for FRAM CF10285, Replacement for Toyota Genuine Part# 87139-02020, 87139-02090, 87139-06040, 87139-06080, 87139-07010, 87139-07020, 87139-08030, 87139-0D010, 87139-0D070, 87139-30040, 87139-30070, 87139-47010, 87139-47010-83, 87139-48020, 87139-50060, 87139-50100, 87139-52020, 87139-52040, 87139-60020, 87139-76010, 87139-YZZ08, 87139-YZZ10, 87139-YZZ16, 87139-YZZ20Replacement for SUBARU / GENERAL MOTORS / JAGUAR Genuine Part# 72880-AJ000, 72880-AJ00A, 72880-AL00A, 87139-52020, SEDNF-29100, SEDNF-29110, 19184673, C2S 52338› See more product details",$9.97$9.97,https://images-na.ssl-images-amazon.com/images/I/81aAVexwuFL.__AC_SY300_SX300_QL70_FMwebp_.jpg,EPAuto,#49 in Automotive (See Top 100 in Automotive)#3 in Automotive Replacement Passenger Compartment Air Filters#3 in Automotive Replacement Air Conditioning Products,"28,610 ratings",Ships from Amazon , EPFamily Direct,No,"September 2, 2015","{'ASIN': 'B014TYRQUY', 'Customer Reviews': '4.7 out of 5 stars28,610 ratings4.7 out of 5 stars', 'Best Sellers Rank': '#49 in Automotive (See Top 100 in Automotive)#3 in Automotive Replacement Passenger Compartment Air Filters#3 in Automotive Replacement Air Conditioning Products', 'Date First Available': 'September 2, 2015', 'Manufacturer': 'EPAuto', 'Brand': 'EPAuto', 'Item Weight': '6.3 ounces', 'Package Dimensions': '8.54 x 7.91 x 1.34 inches', 'Item model number': 'AUTO-CF-002V2', 'Is Discontinued By Manufacturer': 'No', 'Manufacturer Part Number': 'AUTO-CF-002V2', 'OEM Part Number': '800025P, 87139-02020, 87139-02090, 87139-06040, 87139-06080, 87139-07010, 87139-07020, 87139-08030, 87139-0D010, 87139-0D070, 87139-30040, 87139-30070, 87139-47010, 87139-47010-83, 87139-48020, 87139-50060, 87139-50100, 87139-52020, 87139-52040, 87139-60020, 87139-76010, 87139-YZZ08, 87139-YZZ10, 87139-YZZ16, 87139-YZZ20'}"
US,automotive,https://www.amazon.com/dp/B01I0SI1SG,B01I0SI1SG,28/05/2022,15:11:48,"Syncwire 3.5mm Nylon Braided Aux Cable (3.3ft/1m,Hi-Fi Sound), Audio Auxiliary Input Adapter Male to Male AUX Cord for Headphones, Car, Home Stereos, Speaker, iPhone, iPad, iPod, Echo & More – Black",4.6 out of 5 stars,In Stock.,"About this itemUniversal Compatibility: Perfectly compatible with any devices with a 3. 5mm aux port. Such as Apple iPhone, iPod, iPad, Headphones, Hi-Fi, Car Stereos, Tablet, Laptop, Smartphones, MP3 Player, Speaker and any other audio-playing devices. (ATTENTION: Incompatible with Life proof Cases And Otter Box cases)Unparalleled Sound Quality: Polished 24K gold-plated connectors ensure reliability and eliminate signal loss and noise possible, offer clear and stereo sound to your devices.Ultra Durable And Tangle-Free: With an 15000+ ultra-durable bend lifespan several times longer than original audio cables. You can wind it without having to worry about knots or kinks.Easy Carrying And Storage: Double shielding significantly enhances protection against interference, and with the specially designed organizer, no messy or tangled cable any more.What You Get - Sync wire 3.3 ft. Nylon Braided Aux Cable, 3 Years Free Card, User Guide and Customer Service",$7.99,https://images-na.ssl-images-amazon.com/images/I/71y-Tu6hvML.__AC_SX300_SY300_QL70_FMwebp_.jpg,Syncwire,#1 in Car Audio & Video Input Adapters#2 in Stereo 1/4-inch & 1/8-inch Jack Cables,"85,277 ratings",Ships from Amazon ," Syncwire Products Packaging Shows what’s inside.To hide it, choose Ship in Amazon Packaging at Checkout.",Yes,"September 1, 2016","{'Product Dimensions': '4.33 x 0.47 x 2.17 inches', 'Item Weight': '0.8 ounces', 'ASIN': 'B01I0SI1SG', 'Item model number': 'SW-SC017', 'Customer Reviews': '4.6 out of 5 stars85,277 ratings4.6 out of 5 stars', 'Best Sellers Rank': '#1 in Car Audio & Video Input Adapters#2 in Stereo 1/4-inch & 1/8-inch Jack Cables', 'Is Discontinued By Manufacturer': 'No', 'Special Features': 'Incredibly Durable & Tangle-Free, Unparalleled Quality Audio', 'Other display features': 'CE', 'Colour': 'Black', 'Included Components': '3.5mm Premium Aux Cable Auxiliary Input Adapter', 'Manufacturer': 'LEADERMENT INTERNATIONAL GROUP CO.;LTD', 'Date First Available': 'September 1, 2016'}"
US,automotive,https://www.amazon.com/dp/B07PDPCRP4,B07PDPCRP4,28/05/2022,15:11:58,"[3Pack 6ft]Compatible with Samsung Galaxy S9 S10 S8 Plus Charger Cord(3A Fast Charging), TPE USB C Type Charger Cable,USB A to Type C Replacement for Samsung A32/A12/A10e/A20/A51/Note 20/9/8,LG K51",4.6 out of 5 stars,In Stock.,"About this itemThis fits your . Make sure this fits by entering your model number. 【Compatible With】This c charger cable fast charging work with the new USB Type-C devices,Compatible with Samsung Galaxy S22/S22 Ultra/S21/S21 Ultra 5G /S20 FE 5G/S20 5G/S20 Ultra 5G/S19/S10/S10e/S9/S8, Note 10 9 8, Plus/S8+, LG G6,G5,V30,V20, LG Nexus 5X , Lumia 950, Lumia 950XL, ZTE Axon 7, Moto Z2 play,Sony Xperia XZ, HTC U11/10, Nokia N1 and other usb type c cable device.【Spring Protection】An additional spring has been added to the c cable charger fast charge and USB ends to improve durability and reduce fraying. In the laboratory environment, bending test can reach 12,000 times +.【Certified 3Amp Fast Charge】Compared with other USB 2.0 cable that delivers 5V/2.4A current, USB cable provides up to 5V/3A safe charging current, which speed increased by 40%. You can also sync data between two devices with this phone charger c type.【Usb 2.0 Charging & Data Transfer】3 PACK usb c charging cables support safe high-speed charging and fast data transfer (480Mbps).Standard 56KΩ pull-up resistor provides a safer charging current,it can prolong the battery life,6ft makes inconvenient office outlets reachable and makes it easier to use and charge your phone while relaxing in bed. Keep a cable in your home or office as a backup.【What You Get 】2m android charger cable type cX 3, welcome guide.C charger cable fast charging for Samsung Galaxy A10e /A01/A11 / A12/A20 / A20s / A21 / A21s / A30/ A30s / A31/ A32 /A40 / A40s / A41 / A42 / A50 / A50s / A51 / A52 / A60 / A70 / A70s / A71 / A71 5g / A72/A80 / A81 / A90 / A91/A02s/A3 A5 A6 A7(2017) /A8/A8s /A9/A10/Tab S5E /Tab A7 10.4 (2020)/Tab S6/Tab S7 / Tab S7+ / Tab A 10.5(2018) /Tab A 8.0 (2017)",$10.99,https://images-na.ssl-images-amazon.com/images/I/71tA8SEr9vL.__AC_SX300_SY300_QL70_FMwebp_.jpg,CyvenSmart,#110 in Cell Phones & Accessories (See Top 100 in Cell Phones & Accessories)#3 in Cell Phone Automobile Chargers,"50,286 ratings",Ships from Amazon , CyvenSmart,No,"March 14, 2019","{'Customer Reviews': '4.6 out of 5 stars50,286 ratings4.6 out of 5 stars', 'Best Sellers Rank': '#110 in Cell Phones & Accessories (See Top 100 in Cell Phones & Accessories)#3 in Cell Phone Automobile Chargers', 'Brand': 'CyvenSmart', 'Item model number': 'cable', 'Item Weight': '0.023 ounces', 'Product Dimensions': '15.99 x 8.99 x 1 inches', 'Item Dimensions  LxWxH': '15.99 x 8.99 x 1 inches', 'Color': 'SILVER', 'Manufacturer': 'CyvenSmart', 'ASIN': 'B07PDPCRP4', 'Date First Available': 'March 14, 2019'}"
US,automotive,https://www.amazon.com/dp/B08SHXTRPJ,B08SHXTRPJ,28/05/2022,15:12:09,Ontel Car Wash Cannon Foam Blaster Hose Nozzle Spray Gun,4.0 out of 5 stars,In Stock.,"Carwash Cannon is the professional quality car wash system with revolutionary foam blasting technology Just spray and rinse. No more painstaking scrubbing with sponges or mitts or expensive carwashes to get that hand washed shine. Simply attach Carwash Cannon to virtually any garden hose, add liquid car wash soap, and spray your dirty car clean with the thick cleansing foam. Then just turn the dial to the rinse setting and wash the soap away to reveal your clean car. Carwash Cannon infuses massive amounts of air into the soap and water to create a blanket of thick foam, just like a professional carwash This air-charged cleansing foam lifts dirt and dust from the surface and rinses it away without leaving behind any film or residue. Use Carwash Cannon on your car, truck, motorcycle, boat, RV, ATV and more",$16.76,https://images-na.ssl-images-amazon.com/images/I/81lCpQjvDQL.__AC_SX300_SY300_QL70_FMwebp_.jpg,Visit the Ontel Store,#91 in Automotive (See Top 100 in Automotive)#1 in Car Washing Nozzles & Hose Attachments,"2,885 ratings",Ships from Amazon.com ," Amazon.com Packaging Shows what's inside and can’t be hidden. If this is a gift, consider shipping to a different address.",Yes,,"{'Package Dimensions': '9.02 x 7.76 x 4.61 inches', 'Item Weight': '1.14 pounds', 'Manufacturer': 'Ontel', 'ASIN': 'B08SHXTRPJ', 'Country of Origin': 'China', 'Item model number': 'CARC-MC4', 'Customer Reviews': '4.0 out of 5 stars2,885 ratings4.0 out of 5 stars', 'Best Sellers Rank': '#91 in Automotive (See Top 100 in Automotive)#1 in Car Washing Nozzles & Hose Attachments', 'Material Care Instructions': 'See Packaging', 'Assembly Required': 'No', 'Number of Pieces': '1', 'Batteries Required?': 'No', 'Included Components': 'See Packaging'}"
US,automotive,https://www.amazon.com/dp/B00ZOKJVAG,B00ZOKJVAG,28/05/2022,15:12:23,kinder Fluff Car Window Shade (4Pack)-The Only Certified Car Window Sun Shade for Baby Proven to Block 99.95% UVR - Mom's Choice Gold Award Winning -Car Window Shade for Baby- Car Seat Sun Protection,4.3 out of 5 stars,In Stock.,"About this itemThis fits your . Make sure this fits by entering your model number. The only car window shades CERTIFIED to block 99.79% of UVA & 99.95% of UVB. SPF100 & UPF 50+This set contains 2 transparent & 2 semi-transparent car window covers to use according to your needMade of 120 GSM,15S Film & a unique clamp, it's the most durable automotive interior sun protectionThese foldable baby car window shades are designed to fit any windows . Each car shade is 20""x12""Best as baby shower gift , car accessories for men, women , babies & pet in car,truck,suv,van,bus.› See more product details",$14.86,https://images-na.ssl-images-amazon.com/images/I/61ZEebG3pNL.__AC_SY300_SX300_QL70_FMwebp_.jpg,Kinder Fluff,#59 in Automotive (See Top 100 in Automotive)#1 in Car Seat Sun Protection#2 in Side Automotive Window Sunshades#3 in Amazon Launchpad Small Business Promotion,"19,944 ratings",Ships from Amazon , KinderFluff,No,"June 15, 2015","{'ASIN': 'B00ZOKJVAG', 'Customer Reviews': '4.3 out of 5 stars19,944 ratings4.3 out of 5 stars', 'Best Sellers Rank': '#59 in Automotive (See Top 100 in Automotive)#1 in Car Seat Sun Protection#2 in Side Automotive Window Sunshades#3 in Amazon Launchpad Small Business Promotion', 'Date First Available': 'June 15, 2015', 'Manufacturer': 'Kinder Fluff', 'Brand': 'Kinder Fluff', 'Model': 'FBA_KF2 Car-Shade', 'Item Weight': '3.2 ounces', 'Product Dimensions': '20 x 0.1 x 12 inches', 'Item model number': 'KF2 Car-Shade', 'Is Discontinued By Manufacturer': 'No', 'Manufacturer Part Number': 'FBA_KF2 Car-Shade', 'Special Features': ""Mom's Choice Gold Award Winner, The Only Certified Sunshades in The Market Proven to Block 99.95 % UVR., Extendable, Made of 120 GSM Mesh & 15s Film, with Maximum Sun Protection 50+ UPF/SPF 100"", 'Safety Rating': 'ASTM D 6603-19'}"
US,automotive,https://www.amazon.com/dp/B01K478YBA,B01K478YBA,28/05/2022,15:12:41,Shynerk SH-M-02 Baby car mirror,4.6 out of 5 stars,In Stock.,"[Safety Tested & Parent approved] As parents ourselves, we know safety is a top priority.Shynerk baby mirror features a shatter-proof safety which has been crash tested and certified to provide peace of mind that in the event of an accident, your little one is safe. The black polymer plastic holds the mirror tightly in place, furthering the safety of the mirror and making it both lightweight and durable. [Largest mirror &Clearest View] No longer will you need to go through the checklist of reasons baby could be crying, as our specially designed mirror features a Crystal Clear Convex mirror surface, allowing you to see your child from head to toe. The attached ball joint is strong, and rotates 360 degrees, allowing you to choose your preferred viewing angle.Its dimensions are 11.8'' x 7.5'', larger than most baby car mirror. [The Best Deal On The Market] You don't need to break the bank to equip your car with essential accessories. This is why we offer you the Shynerk baby car mirror at the best price you will find. Why pay more for all the same benefits? Click Add To Cart Now For This Lovely Baby Car Mirror!","['$21.99', '$14.99']",https://images-na.ssl-images-amazon.com/images/I/61xyCroSLEL.__AC_SY300_SX300_QL70_FMwebp_.jpg,Shynerk,#71 in Automotive (See Top 100 in Automotive)#1 in Automotive Interior Mirrors#2 in Rear Facing Car Seat Mirrors,"13,140 ratings",Ships from Amazon , Woot,Yes,"August 10, 2016","{'ASIN': 'B01K478YBA', 'Customer Reviews': '4.6 out of 5 stars13,140 ratings4.6 out of 5 stars', 'Best Sellers Rank': '#71 in Automotive (See Top 100 in Automotive)#1 in Automotive Interior Mirrors#2 in Rear Facing Car Seat Mirrors', 'Date First Available': 'August 10, 2016', 'Manufacturer': 'Shynerk', 'Brand': 'Shynerk', 'Model': 'Baby car mirror', 'Item Weight': '13.4 ounces', 'Product Dimensions': '11.8 x 7.4 x 1.1 inches', 'Item model number': 'SH-M-02', 'Is Discontinued By Manufacturer': 'No', 'Manufacturer Part Number': 'SH-M-02', 'Mirror Lens Type': 'Convex', 'Lift Type': 'Manual'}"
